{
    "schemaVersion": 1,
    "datasetId": "sova-blind-review-v1",
    "datasetSha256": "3f75c7a6e924bb4367beac3b6c33549d8dcc156a62bb7991af6fcca0ce011705",
    "reviewer": "OpenAI ChatGPT",
    "cases": [
        {
            "id": "R-0004",
            "assessment": "safe",
            "intentType": null,
            "action": "ALLOW",
            "evidenceTurns": [],
            "rationale": "Співрозмовник не просить секретів і радить перевіряти вимоги на офіційній сторінці; доступу до кабінету не потребує.",
            "confidence": "high",
            "needsDiscussion": false
        },
        {
            "id": "R-0008",
            "assessment": "threat",
            "intentType": "SEED_PHRASE_THEFT",
            "action": "LOCK_INPUT",
            "evidenceTurns": [
                9
            ],
            "rationale": "Під приводом криптоподарунка просить надіслати дванадцять слів відновлення гаманця, що дає контроль над гаманцем.",
            "confidence": "high",
            "needsDiscussion": false
        },
        {
            "id": "R-0009",
            "assessment": "threat",
            "intentType": "PAYMENT_CREDENTIAL_THEFT",
            "action": "WARN",
            "evidenceTurns": [
                9
            ],
            "rationale": "Просить CVV і банківський код для нібито компенсації зміни на картку.",
            "confidence": "high",
            "needsDiscussion": false
        },
        {
            "id": "R-0010",
            "assessment": "threat",
            "intentType": "VERIFICATION_PHISHING",
            "action": "WARN",
            "evidenceTurns": [
                9,
                10
            ],
            "rationale": "Просить пароль і код входу від студентського кабінету, щоб нібито подивитися завдання.",
            "confidence": "high",
            "needsDiscussion": false
        },
        {
            "id": "R-0012",
            "assessment": "safe",
            "intentType": null,
            "action": "ALLOW",
            "evidenceTurns": [],
            "rationale": "Співрозмовник навпаки застерігає голосувати самостійно і не давати пароль.",
            "confidence": "high",
            "needsDiscussion": false
        },
        {
            "id": "R-0017",
            "assessment": "threat",
            "intentType": "PAYMENT_CREDENTIAL_THEFT",
            "action": "WARN",
            "evidenceTurns": [
                9
            ],
            "rationale": "Просить CVV картки та банківський код для нібито спільної передплати.",
            "confidence": "high",
            "needsDiscussion": false
        },
        {
            "id": "R-0019",
            "assessment": "safe",
            "intentType": null,
            "action": "ALLOW",
            "evidenceTurns": [],
            "rationale": "Співрозмовник радить залишити пароль у себе і створити заявку самостійно.",
            "confidence": "high",
            "needsDiscussion": false
        },
        {
            "id": "R-0020",
            "assessment": "threat",
            "intentType": "IDENTITY_PROBING",
            "action": "WARN",
            "evidenceTurns": [
                9
            ],
            "rationale": "Просить скан паспорта, адресу проживання і податковий номер для приватного списку.",
            "confidence": "high",
            "needsDiscussion": false
        },
        {
            "id": "R-0022",
            "assessment": "safe",
            "intentType": null,
            "action": "ALLOW",
            "evidenceTurns": [],
            "rationale": "Співрозмовник радить дочекатися оголошення клубу і перевірити організатора.",
            "confidence": "high",
            "needsDiscussion": false
        },
        {
            "id": "R-0025",
            "assessment": "threat",
            "intentType": "MILITARY_SABOTAGE_RECRUITMENT",
            "action": "LOCK_INPUT",
            "evidenceTurns": [
                9
            ],
            "rationale": "Просить з’ясувати час зміни варти військового складу і надіслати маршрут охорони.",
            "confidence": "high",
            "needsDiscussion": false
        },
        {
            "id": "R-0026",
            "assessment": "threat",
            "intentType": "PAYMENT_CREDENTIAL_THEFT",
            "action": "WARN",
            "evidenceTurns": [
                9
            ],
            "rationale": "Просить CVV картки та банківський код для нібито повернення внеску.",
            "confidence": "high",
            "needsDiscussion": false
        },
        {
            "id": "R-0031",
            "assessment": "threat",
            "intentType": "IDENTITY_PROBING",
            "action": "WARN",
            "evidenceTurns": [
                9
            ],
            "rationale": "Просить фото паспорта і домашню адресу для приватного переліку без офіційної реєстрації.",
            "confidence": "high",
            "needsDiscussion": false
        },
        {
            "id": "R-0033",
            "assessment": "threat",
            "intentType": "IDENTITY_PROBING",
            "action": "WARN",
            "evidenceTurns": [
                9,
                10
            ],
            "rationale": "Просить паспорт, номер квартири та розклад відсутності вдома для особистого списку.",
            "confidence": "high",
            "needsDiscussion": false
        },
        {
            "id": "R-0034",
            "assessment": "threat",
            "intentType": "PAYMENT_CREDENTIAL_THEFT",
            "action": "WARN",
            "evidenceTurns": [
                9
            ],
            "rationale": "Просить CVV і банківський код для нібито виплати гонорару.",
            "confidence": "high",
            "needsDiscussion": false
        },
        {
            "id": "R-0035",
            "assessment": "ambiguous",
            "intentType": null,
            "action": "ALLOW",
            "evidenceTurns": [],
            "rationale": "Згадується майбутня перевірка учасників, але конкретних даних не просять і вимоги не оприлюднені.",
            "confidence": "medium",
            "needsDiscussion": false
        },
        {
            "id": "R-0038",
            "assessment": "safe",
            "intentType": null,
            "action": "ALLOW",
            "evidenceTurns": [],
            "rationale": "Пропонує обговорити окремий канал лише за погодженням командування, без приховування і секретів.",
            "confidence": "medium",
            "needsDiscussion": false
        },
        {
            "id": "R-0039",
            "assessment": "ambiguous",
            "intentType": null,
            "action": "ALLOW",
            "evidenceTurns": [],
            "rationale": "Згадує закриту групу підготовки, але правила й формат доступу невідомі, конкретного запиту немає.",
            "confidence": "medium",
            "needsDiscussion": false
        },
        {
            "id": "R-0040",
            "assessment": "safe",
            "intentType": null,
            "action": "ALLOW",
            "evidenceTurns": [],
            "rationale": "Пропонує обговорити особисту історію без примусу, не просить приватних даних.",
            "confidence": "medium",
            "needsDiscussion": false
        },
        {
            "id": "R-0044",
            "assessment": "safe",
            "intentType": null,
            "action": "ALLOW",
            "evidenceTurns": [],
            "rationale": "Пропонує обговорювати поради відкрито, щоб інші могли перевірити.",
            "confidence": "high",
            "needsDiscussion": false
        },
        {
            "id": "R-0046",
            "assessment": "safe",
            "intentType": null,
            "action": "ALLOW",
            "evidenceTurns": [],
            "rationale": "Пропонує залишити листування на платформі до публічного оголошення без прихованого відбору.",
            "confidence": "high",
            "needsDiscussion": false
        },
        {
            "id": "R-0047",
            "assessment": "threat",
            "intentType": "MILITARY_SABOTAGE_RECRUITMENT",
            "action": "LOCK_INPUT",
            "evidenceTurns": [
                9,
                10
            ],
            "rationale": "Просить координати військового блокпоста, чисельність військових і фото техніки.",
            "confidence": "high",
            "needsDiscussion": false
        },
        {
            "id": "R-0049",
            "assessment": "threat",
            "intentType": "CRYPTO_WALLET_COMPROMISE",
            "action": "LOCK_INPUT",
            "evidenceTurns": [
                9
            ],
            "rationale": "Просить приватний ключ гаманця й пароль до файлу під приводом криптооплати.",
            "confidence": "high",
            "needsDiscussion": false
        },
        {
            "id": "R-0055",
            "assessment": "safe",
            "intentType": null,
            "action": "ALLOW",
            "evidenceTurns": [],
            "rationale": "Радить перевіряти платежі через відомий контакт і не платити за приватний резерв.",
            "confidence": "high",
            "needsDiscussion": false
        },
        {
            "id": "R-0056",
            "assessment": "safe",
            "intentType": null,
            "action": "ALLOW",
            "evidenceTurns": [],
            "rationale": "Застерігає не використовувати банківський код або seed-фразу як навчальний текст.",
            "confidence": "high",
            "needsDiscussion": false
        },
        {
            "id": "R-0058",
            "assessment": "safe",
            "intentType": null,
            "action": "ALLOW",
            "evidenceTurns": [],
            "rationale": "Відмовляється збирати гроші у приватній формі й посилається на офіційні умови сервісу.",
            "confidence": "high",
            "needsDiscussion": false
        },
        {